QuestionType,Asin,AnswerTime,UnixTime,Question,AnswerType,Answer,Category
yes/no,B002ITKQKU,"Oct 25, 2013",1382684400.0,does it work with hp touchpad for sure?,?,"It is charging my rooted HP Touchpad running Android as I type this, but pretty much all chargers that output 5v1A do so. It's possible that the people saying it doesn't charge are running the stock operating system. I wouldn't expect anything except the OEM charger to work if it's not running Android.",Cell Phones and Accessories
open-ended,B002ITKQKU,"Mar 19, 2015",1426748400.0,Anyone know the amperage output of this?,,"I am honestly not sure, but it is our go to OEM spare charger for the Galaxy S4s we have. Has been really good and incredible value. It's funny the touchstone is now a freebie. My wife Loved her Palm Pre and it's very well made. Although it's not designed for devices that need more power like an Amazon Fire. And Googling it, it looks like 1.0 Amps.",Cell Phones and Accessories
open-ended,B002ITKQKU,"Jan 30, 2015",1422604800.0,Does it work with a Chromo 7 tablet or Samsung galaxy 4 tablet ?,,It has been my experience that it works with anything that has a mini-USB female outlet. You can also use the plug to power/charge any device by using a cord with a standard 2.0 USB male. I have used it to charge my glucose monitor.,Cell Phones and Accessories
open-ended,B002ITKQKU,"Jan 23, 2015",1422000000.0,Micro USB? Might this work for my galaxy note 4?,,"my hp didn't recognize it but let it charge. i don't think you can do anything but charge at that time , though",Cell Phones and Accessories
yes/no,B002ITKQKU,"Feb 22, 2014",1393056000.0,does this cable fit the touchston for the pre's back?,Y,"Yes, it does. It will work for you.",Cell Phones and Accessories
yes/no,B002ITKQKU,"Nov 5, 2013",1383638400.0,does this work with pixi plus?,?,"Good question. As a generic usb charger at 1 amp, this charger works fine. That said, not all micro usb cables/chargers 'talk' the same, usually due to shorting of pins 2-3, etc to indicate an AC (higher current) charger. Generally, if you use your original usb to micro usb charging cable, you should be fine. I'm not sure whether this charger is designed to short pins 2-3 (or similar) inside the charger itself. If not, it should still provide the usb standard 500ma, as if connected to a generic pc usb port.",Cell Phones and Accessories
open-ended,B002ITKQKU,"Sep 26, 2013",1380178800.0,length,,4.5 ft on the cable I received.,Cell Phones and Accessories
yes/no,B002ITKQKU,"Aug 20, 2013",1376982000.0,does this work with a nook tablet?,?,i am not sure since i dont have a nook but if it has micro charger slot then it should work,Cell Phones and Accessories
yes/no,B002ITKQKU,"Aug 17, 2013",1376722800.0,does it work with iphone5,N,No,Cell Phones and Accessories
yes/no,B002ITKQKU,"May 27, 2013",1369638000.0,does it work with HP touchpad?,?,"I don't know about the HP specifically, but as it works with both the Kindle fire and the Samsung note II, it seems to be universal.",Cell Phones and Accessories
yes/no,B002IVU3JM,"Dec 10, 2013",1386662400.0,"Would this work with a samsung galaxy 4 active, It's 3 inches wide?",?,I don't own a galaxy to be positive but I measured the Arkon and it's 3 1/4 inches wide. So I would have to say yes it would because you don't need a lot to clamp it.,Cell Phones and Accessories
open-ended,B002IVU3JM,"Sep 20, 2013",1379660400.0,How wide does the cradle open?,,estimate 21/2 inches,Cell Phones and Accessories
open-ended,B002IVU3JM,"Nov 11, 2013",1384156800.0,otterbox,,yes,Cell Phones and Accessories
yes/no,B002IVU3JM,"Jan 16, 2013",1358323200.0,Does this vent mount work with the IPhone 5?,?,"It should work the same for the iPhone 5, but I cannot be 100% sure.",Cell Phones and Accessories
open-ended,B002IVU3JM,"Jan 16, 2013",1358323200.0,Does the Arkon Sm329-Sbh Vent Mount fit the iPhone 3GS (with cases)? I was just wondering if anyone knows if the Arkon Sm329-Sbh will fit my iPhone 3GS with a case (not a crazy big one a thinner type)?,,"Yes, I used this with an iPhone 3gs that had a fairly thick case. The side clamps are ratcheting so it will fit just about any width of phone.",Cell Phones and Accessories
open-ended,B002JCSAWM,"Apr 14, 2012",1334386800.0,Does the powermat PMM charge the Kindle? But will it charge a Kindle?,,does this product work on the kindle fire?,Cell Phones and Accessories
yes/no,B002JCSAWM,"Jan 14, 2014",1389686400.0,Can I use my Canon battery charger for a EOS Rebel T4i/650D camera with this unit?,?,I wouldn't. This thing is terrible.,Cell Phones and Accessories
open-ended,B002JCSAWM,27 days ago,,Can it work with Samsung S2 or S4? Thank you!,,Did not like how it was suppose to work..I gave it away.,Cell Phones and Accessories
yes/no,B002JCSAWM,"Jul 21, 2014",1405926000.0,will this pad charge the kindal fire,?,"No. This pad won't charge anything. The stupid tiny dot is harder to line up than just plugging in a USB cord. I had the prior generation of Power Mat and it was somewhat like expected. You lay the item down and it charges it. This one has a magnetic thing on your device and takes Robin Hood level accuracy to line it up with the marked dot on the pad itself. At which point it makes a really nifty sound to announce it's charging, then a rather depressing sound when the wind from you removing your hand nudges the device the requisite .002mm off target and you are no longer charging. Avoid this device (at least this model with the stupid magnetic dot) at all costs!",Cell Phones and Accessories
yes/no,B002JCSAWM,"Jan 25, 2014",1390636800.0,will it charge my galaxy s2 without having to plug anything into the charging port of my phone ?,?,No... you have to plug the white magent (power cube) charger into your phone then lay it on the charging mat.... this is a terrible waste of money as it isnt REALLY wireless charging,Cell Phones and Accessories
open-ended,B002JCSAX6,"Mar 11, 2015",1426057200.0,"Is this just an adapter, or does this powercube hold power to charge devices later, like a backup battery?",,"No, its only an adapter in a form of a box",Cell Phones and Accessories
yes/no,B002JCSAX6,"Mar 6, 2015",1425628800.0,will it work for the iphone 6?,Y,If you install the official Micro USB to lightning adaptor from Apple it should work.,Cell Phones and Accessories
open-ended,B002JCSAX6,"Jun 18, 2014",1403074800.0,"I need to charge a nintendo DSI that has a broken recharging port. Can this be done using the Powermat? If so, what connectors are needed?",,It come with the connector for the ds,Cell Phones and Accessories
open-ended,B002JCSAX6,"Jun 18, 2014",1403074800.0,How do you get power to the power mat? Is there a standard size USB connector/adapter?,,"This is not a powermat This is an adapter for all phones, the powermat has one power source to conect in wall plug. Some powermat has an USB to plug a phone. This adapter connects the phone with the powermat.",Cell Phones and Accessories
yes/no,B002JCSAX6,"Jun 16, 2014",1402902000.0,does this work for samsung s4 phone ?,?,I have a S4 mini and it works,Cell Phones and Accessories
yes/no,B002JCSAX6,"May 26, 2014",1401087600.0,is there a tip for motorola droid razr?,?,There was a tip for mine.,Cell Phones and Accessories
yes/no,B002JCSAX6,"Jan 11, 2014",1389427200.0,Is there a tip available for the iPhone 5x devices?,Y,Yes it comes with an adapter,Cell Phones and Accessories
yes/no,B002JCSAX6,"Jan 4, 2014",1388822400.0,do you have to plug it into the power port of the device you want to charge?,Y,Yes. So you still have to plug something into the device so this is silly. But if you own a power mat and really want to use it then this is what you need. Hopefully more devices come with inductive charging built-in in the future. More expensive ones will or they will at least have an adapter available that actually becomes part of the device.,Cell Phones and Accessories
open-ended,B002JCSAX6,"Dec 7, 2013",1386403200.0,How many devices does it charge?,,3 or 4,Cell Phones and Accessories
yes/no,B002JCSAX6,"Jun 16, 2013",1371366000.0,Does it work with kindle fire hd?,?,You'd have to have the tips from the original purchase of the mat to know- and unfortunately I've never tried those with a Kindle. Very sorry!,Cell Phones and Accessories
open-ended,B002JCSAWW,"Oct 17, 2013",1381993200.0,"I have a Samsung Galaxy SIII, with a damaged charging port. Can I charge it on this mat or does it have to plug in? What will I need?",,No the mat did not work at all for me. Look for something you can plug into the wall that the battery fits in. Not sure what its called but I have seen them. Don't waste you're money on this mat. Good luck,Cell Phones and Accessories
open-ended,B002JCSAWW,"Mar 28, 2014",1395990000.0,my charge port on my kindle is broke will it charge the kindle with out plugging in i just lay it on there right,,"No, it will not. In order for this charging pad to charge anything that can't or won't accept a plug, the device must have a special battery that accepts an inductive charge just like the little widget that sits on top of this pad. Nokia and a few other manufacturers have inductive pickups built into some of their phones and they will work with this pad.",Cell Phones and Accessories
open-ended,B002JCSAWW,"Feb 3, 2014",1391414400.0,will this charge my HP slate 7? the actual USB port is broken. so will it work wireless?,,Not unless your Slate will accept the inductive charging unit that would replace the original battery. This was a good idea rhat never really panned out. It comes with an inductive pad that sits on one of three positions of the skateboard like charging unit where it pickt up the charging current and transfers it via conventional usb or other connections to your device. Unless you either have a device that can work directly with inductive charging or you replace your original battery with one that will accept this type of charging.,Cell Phones and Accessories
yes/no,B002JCSAWW,"Aug 26, 2013",1377500400.0,Will it charge a kindle?,Y,yes with the external cable provided by power mat,Cell Phones and Accessories
open-ended,B002JCSAWW,"Feb 20, 2014",1392883200.0,what do i need to use this with my samsung galaxy infuse 4g phone? my port is messed up so i need something that is wireless..,,this is not going to work for you. this requires a small device be plugged into your phone and the device is wireless to the mat.,Cell Phones and Accessories
open-ended,B002JCSAWW,"Jun 14, 2010",1276498800.0,better version of this product? Isn't there supposed to be a new and improved version of this product with wireless batteries that fit inside your devices?,,This months Inc Magazine mentions up to 7 new battery/receivers coming out in July 2010 with more to come. Inc only mentioned a Blackberry and Droid battery so we'll have to wait to see what products the other 5 batteries fit. It sounds like they will eventually do away with battery door replacements and have only replaceable battery/receivers. Of course Apple users will always have to buy an add-on device since they don't have replaceable batteries. Apple users will get internal inductive charging when Apple decides it wants to give it to them - and users will have to buy a new phone to get it. BlackBerry & Droid users can have it as soon as July when PowerMat releases the replacement batteries.,Cell Phones and Accessories
yes/no,B002JCSAWW,"Oct 13, 2014",1413183600.0,will this work for the kyocera hydro icon im looking for a wireless carger cause i just bought the icon but cant find it anywhere.,?,"According to this website it does. http://www.cnet.com/products/kyocera-hydro-icon/2/ Another plus: the Icon offers wireless charging, with support for PMA-enabled charge pads. Certification by http://www.powermatters.org/certification/certified-products",Cell Phones and Accessories
open-ended,B002JCSAWW,"Mar 10, 2014",1394434800.0,"I have a iPod 4th generation, with a damaged charging port. Can I charge it on this mat or does it have to plug in? What will I need?",,"Unfortunately, no. The Powermat wirelessly connects with a small accessory that must still be plugged in to the iPod. Actually, the Powermat is a useless accessory, as it would be no different than plugging it in to a charger.",Cell Phones and Accessories
yes/no,B002JCSAWW,"May 8, 2013",1367996400.0,I would like to know if this product(power mat) could charge samsung s 3 and other samsung,Y,"Yes, you have to buy the case for the s3 or buy another charge block to plug into the phone. It doesn't just charge the phones by you laying the phone on the mat. You either have to have the power at case or you have to plug in the power block and lay that on the mat.",Cell Phones and Accessories
open-ended,B002JCSAWW,"Apr 20, 2013",1366441200.0,what do i need to charge 2 samsung galaxy phones? do i have to take them out of their cases to charge?,,Do you have the power mat cases?,Cell Phones and Accessories
yes/no,B002JXP9WA,"Jan 19, 2013",1358582400.0,Can this phone use for T-mobile network?,?,"Hello, If the phone is unlocked it should be able to be used on T-mobile's network. I cannot answer whether you would be able to use picture messaging or the internet on the phone on t-mobile's network, as sometimes those features become dormant or non-usable when using a phone on a different network then the one it was originally set up for. I hope this helps.",Cell Phones and Accessories
yes/no,B002JXP9WA,"Feb 23, 2013",1361606400.0,"Does this order come with any accessories like wall charger, car charger, headphones?",?,I received wall charger and earbuds usb cable. this phone will freeze and turn on and off. not happy wish i had not purchased...,Cell Phones and Accessories
yes/no,B002JXP9WA,"Jun 17, 2013",1371452400.0,Does this phone work with a SIM card?,Y,"Yes, it is unlocked and works with most SIM cards.",Cell Phones and Accessories
yes/no,B002JXP9WA,"Nov 24, 2013",1385280000.0,is it a Smart phone?,N,No.,Cell Phones and Accessories
yes/no,B002JXP9WA,"Feb 18, 2015",1424246400.0,Can this phone be used in Cameroon?,N,No,Cell Phones and Accessories
yes/no,B002JXP9WA,"Jan 2, 2014",1388649600.0,can it be used in other countries?,?,"Don't know, never been out of the U.S.",Cell Phones and Accessories
open-ended,B002JXP9WA,"Nov 20, 2013",1384934400.0,what is the screen size pls.,,"dont have that phone anymore,but loved it very easy to understand",Cell Phones and Accessories
open-ended,B002JXP9WA,"Oct 25, 2013",1382684400.0,How long is the warranty on this phone?,,There is no warranty. My phone works great.,Cell Phones and Accessories
open-ended,B002JXP9WA,"Feb 16, 2013",1361001600.0,Does this phone use a regular or micro sims card?,,Micro,Cell Phones and Accessories
yes/no,B002JXP9WA,"Feb 13, 2013",1360742400.0,can this phone used in jamaica,?,"absolutely, this is a quadband phone that means you can use it anywhere or internationally",Cell Phones and Accessories
open-ended,B002K9IPOC,"Jan 5, 2014",1388908800.0,"To remove the smartphone is it necessary to take the entire cradle off, as per instructional video, or can you just remove the phone?",,You can remove the phone by pushing the release button on the back of the cradle.,Cell Phones and Accessories
yes/no,B002K9IPOC,"Mar 13, 2013",1363158000.0,Will it fit an iPhone for with a thin protective case on it?,?,Absolutely. The fit for the iPhone with this device is very flexible. I don't think you would find any challenge here.,Cell Phones and Accessories
yes/no,B002K9IPOC,"Feb 26, 2015",1424937600.0,will it work with an ipod?,Y,Yes it will work for an ipod. It allows you to squeeze the sides close enough to where you feel like your device is safe and secure.,Cell Phones and Accessories
open-ended,B002K9IPOC,"Feb 1, 2011",1296547200.0,"Satechi SCR-31 car holder -- work with iphone 4 WITH bumpers? Will the ""cradle 2"" work well with the new phone?",,"We have an instructional video, please visit our youtube channel to see it; www.youtube.com/satechi Thank you, Arthur Satechi Technical Support",Cell Phones and Accessories
yes/no,B002K9IPOC,"Jan 2, 2014",1388649600.0,Do the lower supports on the Satechi CR-3600 block the iPhone 5 headphone jack? From the pictures it looks like the headphone jack is blocked.,?,Someone please answer this question. The pictures almost clearly show that the headphone jack is not accessible because the bottom-left support blocks it.,Cell Phones and Accessories
yes/no,B002K9IPOC,"Feb 26, 2015",1424937600.0,Will this work with a Galaxy S5 in an Otterbox Defender?,Y,Yes my s4 fit with both otterbox cases.,Cell Phones and Accessories
open-ended,B002K9IPOC,"Nov 19, 2014",1416384000.0,How does the suction mount suck on? There is no video. My Ottie mount uses a lever to lock down the suction cup. Do you turn this one? Thanks!,,"This one has a knob that you twist to obtain maximum suction. The only issue I've had with it is that the black dash of my car absorbs so much heat, that when it gets to 90+ degrees, the dash mount would just fall off.",Cell Phones and Accessories
yes/no,B002K9IPOC,"Jul 21, 2014",1405926000.0,will it work on an iphone 5 with otter box case?,Y,It will work with all the phones. Its adjustable and can be expanded to the size of the phone.,Cell Phones and Accessories
yes/no,B002K9IPOC,"Jul 19, 2014",1405753200.0,"if i use it to record videos, will this work?",?,I don't know that it would. The purpose of the Satechi mount is to use the iPhone as a GPS unit in your vehicle.,Cell Phones and Accessories
yes/no,B002K9IPOC,"Jul 9, 2014",1404889200.0,does this fit the samsung galaxy 5s active?,Y,Yes it is universal which means it will fit any phone.,Cell Phones and Accessories
yes/no,B002KERJUI,"Nov 30, 2012",1354262400.0,IS THIS -PHONE UNLOCKED,Y,"Yes, it is.",Cell Phones and Accessories
yes/no,B002KERJUI,"Jun 5, 2013",1370415600.0,"hi if i buy this phone, can it be used in trinidad with a digicel sim card?",Y,"Dear Customer, yes it will work in Trinidad. It is unlocked to work on any GSM network worldwide",Cell Phones and Accessories
yes/no,B002KERJUI,"Aug 22, 2014",1408690800.0,Can it be used in Venezuela?,N,"No, nunca funciono perd todo el dinero y nunca se hicieron responsable",Cell Phones and Accessories
yes/no,B002KERJUI,"Nov 30, 2013",1385798400.0,does it have wifi?,N,"no, do not bring wifi",Cell Phones and Accessories
yes/no,B002KERJUI,"May 22, 2013",1369206000.0,Can this phone be used with an AT&amp;T SIM card?,N,No amigo es un total fraude no se lo recomiendo busque otro vendedor,Cell Phones and Accessories
open-ended,B002KERJUI,"May 15, 2012",1337065200.0,"ok buenas tardes, como se yo si este telefono es GSM o normal de chip? ok buenas tardes, como se yo si este telefono es GSM o normal de chip?",,"Buenas tardes, este telefono tiene camara.",Cell Phones and Accessories
open-ended,B002KH2E1O,"Apr 6, 2014",1396767600.0,hi the phone has arabic or not thanx,,Just checked my E52 Languages Menu and Arabic was not one of the choices,Cell Phones and Accessories
open-ended,B002KH2E1O,"Oct 2, 2014",1412233200.0,what is the color of this,,Mine has a somewhat dark satin nickel finish,Cell Phones and Accessories
yes/no,B002KH2E1O,"Jul 29, 2014",1406617200.0,Can I to install it Whatsapp?,N,I did not try to install Whatsapp on this Nokia device since I am using it for calls only.,Cell Phones and Accessories
yes/no,B002KH2E1O,"Jun 2, 2014",1401692400.0,Is it with Arabic letter,?,"No,it is not",Cell Phones and Accessories
yes/no,B002KH2E1O,"Jul 28, 2013",1374994800.0,can we use this cellphone in the philippines,Y,"Hello, Yes this cellphone is unlocked, it means you can use it with any GSM sim card i nany country. Regards, Hanna Oliver HIGH-TECH GLOBAL",Cell Phones and Accessories
yes/no,B002KQLUVU,"Feb 23, 2011",1298448000.0,can this phone be used in venezuela,?,"chicos yo compre uno todo perfecto lo uso con movilnet funciona pin y EDGE perfectamente, a mi me llego caja sellada dentro de otra de carton de amazon muy bien envuelto asi que se puede comprar con confianza para venezuela",Cell Phones and Accessories
yes/no,B002KQLUVU,"Jun 5, 2013",1370415600.0,will it work in India?,Y,"yes the phone will defenately work in I ndia , IT WILL WORK IN ANY 850,900 1900AND UP.",Cell Phones and Accessories
yes/no,B002KQLUVU,"Oct 13, 2013",1381647600.0,will this phone work in Australia with a prepaid sim card purchased there?,Y,yes it work anywhere in the world,Cell Phones and Accessories
yes/no,B002KQLUVU,"Nov 16, 2013",1384588800.0,does it work with simcard,Y,Yes,Cell Phones and Accessories
yes/no,B002KQLUVU,"Nov 13, 2013",1384329600.0,would it work in d Caribbean with a prepaid sim purchase there?,Y,Yes I am using mine in the Caribbean. I know it works with Lime and Digicel. It should work with any other sim card,Cell Phones and Accessories
yes/no,B002KQLUVU,"Mar 21, 2014",1395385200.0,Does it carry in T-Mobile?,Y,"If its unlocked it should carry any Network that uses a GSM sim card, which includes T-Mobile. So the answer is yes.",Cell Phones and Accessories
open-ended,B002KQLUVU,"Nov 17, 2011",1321516800.0,"This phone should work in Ecuador with Claro: Could someone tell me if this phone works in Ecuador with course and if there is to unlock SIM card to work, or work with AT &amp; T or T-mobile?",,it's unlocked so that means that'll work with claro movistar and maybe allegro I live in Loja I bought this cellphone and it works just fine.,Cell Phones and Accessories
yes/no,B002KQLUVU,"Apr 2, 2015",1427958000.0,"does it take a sim card, if so what type?",Y,"Yes, a micro SD card, they sell them in Wal-Mart or other stores, different brands, as well as storage capacities.",Cell Phones and Accessories
yes/no,B002KQLUVU,"Jan 16, 2015",1421395200.0,is this a smart phone?,N,No,Cell Phones and Accessories
yes/no,B002KQLUVU,"Sep 30, 2014",1412060400.0,Is there a warranty for this phone?,Y,yes so good this phone,Cell Phones and Accessories
yes/no,B002L7DQF6,"Jan 6, 2015",1420531200.0,Does this Phone work in Venezuela?,Y,I purchased the phone for my daughter and she said it didn't work well overseas.,Cell Phones and Accessories
open-ended,B002L7DQF6,"Dec 9, 2014",1418112000.0,this phose use sim card?,,Yes.,Cell Phones and Accessories
open-ended,B002L7DQF6,"Sep 1, 2014",1409554800.0,"I bought this phone a few days ago, took it to Angola and neither the internet nor the other network programs are not working. even the weather forecast and the bluetooth are not working. What can i do to make it work properly?",,Was returned the item This phone doesn't work,Cell Phones and Accessories
yes/no,B002L7DQF6,"Aug 24, 2014",1408863600.0,Does this Phone work in India?,Y,Yes work in india,Cell Phones and Accessories
yes/no,B002L7DQF6,"Aug 5, 2014",1407222000.0,is this GSM compatible?,Y,Yes,Cell Phones and Accessories
open-ended,B002L7DQF6,"Aug 1, 2014",1406876400.0,What size SIM does it take?,,standard sim,Cell Phones and Accessories
yes/no,B000Q6UPZI,"Dec 1, 2013",1385884800.0,is this a replacement foil for the Braun 7526,?,I don't believe so.,Health and Personal Care
yes/no,B000Q6UPZI,"Jul 5, 2013",1373007600.0,Is this a replacement foil for the Series 7 760 cc?,?,It was the Series 7 790 cc,Health and Personal Care
yes/no,B000Q7TJ86,"Jun 19, 2013",1371625200.0,Could the seller please indicate the number of tubes for $50?,?,My order was for the 2012 holiday season - at that time I got 6 tubes in the pack,Health and Personal Care
open-ended,B000Q7TJ86,"Jun 7, 2013",1370588400.0,how many for $50.00 ?,,"In the stores in my area, they run about $10.00 per tube. On Amazon they were less - but then of course you have to pay shipping. It ended up being about $1.00 less per tube than in a retail store (in my area - southeast PA). So I guess the answer to your inquiry would be ~6 tubes for $50.00.",Health and Personal Care
open-ended,B000Q7TJ86,"Apr 8, 2014",1396940400.0,How many 3.5 oz tubes are in this price for $49.97?,,"THIS ITEM WAS DISCONTINUED and cannot be found in stores. The listing is for ONE tube, NOT SIX.",Health and Personal Care
open-ended,B000Q96XC4,"Aug 12, 2014",1407826800.0,where can i get a replacement charger,,Good afternoon. I had to actually order another shaver.,Health and Personal Care
yes/no,B000Q96XC4,"Dec 21, 2013",1387612800.0,Is this shaver okay to use in the shower?,?,It should be safe to use in the shower as long as it is not being charged from an outlet.,Health and Personal Care
open-ended,B000Q96XC4,"Dec 14, 2014",1418544000.0,What power cord for sp 12,,KHU033200 modelac/dc adaptor,Health and Personal Care
open-ended,B000Q96XC4,"Aug 18, 2014",1408345200.0,replacement charger,,I just got another shaver. Maybe there's a charger on eBay...,Health and Personal Care
open-ended,B000Q96XC4,"May 23, 2014",1400828400.0,What voltage can we use with the AC adapter? Can we use both 110 and 220 volt outlet?,,"Adapter is marked for 110 Volts AC only. Remember, it's only a $10.00 shaver.",Health and Personal Care
open-ended,B000Q96XC4,"Jun 26, 2013",1372230000.0,how do you change the blades?,,"Perhaps I'm missing something. I've had the shaver for over a year & not had to change the blades. As they're self-sharpening & easily cleaned with water, I don't see the need to change them. What comes with the shaver is a screen to replace the original one. Is that protective screen the thing you're looking to replace? If not, let me know & I'll try to help further. I'd suggest contacting the seller or manufacturer. Best wishes.",Health and Personal Care
open-ended,B000Q96XC4,"Jan 25, 2014",1390636800.0,Where can I buy replacement screens?,,"Not sure. My shaver came with a spare, and when that wore out, I got a new shaver.",Health and Personal Care
