QuestionType,Asin,AnswerTime,UnixTime,Question,AnswerType,Answer,Category
open-ended,B00002243Y,"Jan 29, 2014",1390982400.0,How many amps can this handle?,,Per Coleman Cable specifications 4 gauge 20 foot long cables current rating is 300 amps.,Automotive
yes/no,B00002243Y,"Jan 26, 2014",1390723200.0,Can I use this cables to boost a school bus ?,N,I would think so. I bought them to charge a pull behind dump trailer when the battery would not work. The cables just do reach from the battery on my 350 truck to the back of my truck where the battery is on the trailer. These are the only cables I found that were long enough without going to the super expensive ones.,Automotive
open-ended,B00002243Z,"Jan 29, 2013",1359446400.0,What is the most useful length to get?,,at least 20 feet.......heres why....say you have to pull up behind a dead battery car (end to end) you will want the cables to fit from yours to theirs......hope it helps!,Automotive
open-ended,B00002243Z,"Oct 26, 2013",1382770800.0,Are these cables made of copper or aluminum?,,"Coleman's website does indeed say copper equivalent for ""cable gauge."" It also says CCA for ""conductor stranding,"" which stands for copper clad aluminum. It is an aluminum wire with a copper outer layer.",Automotive
yes/no,B00002243Z,"Dec 24, 2013",1387872000.0,I bought the Red Extra Heavy Duty. Is that too much for a full size car?,?,"For jumper cables, you can never have ""too much"". It might be a little ""over-kill"" but it won't hurt. You may meet someone someday who needs a little help and you will have more than enough capacity to do the job. I think you made a great choice. (I have been an Aircraft & Automotive mechanic for more than 35 years.)",Automotive
yes/no,B00002243Z,"Jan 31, 2014",1391155200.0,"Hi, Being 20ft 4gauge how heavy is this?",?,Not nearly heavy enough. I keep them under my back seat for emergencies only. If you need daily heavy use cables these arent for you.,Automotive
yes/no,B00002243Z,"Dec 1, 2014",1417420800.0,Do these cables come with a bag?,N,No,Automotive
yes/no,B00002243Z,"Jan 31, 2014",1391155200.0,Are the wires paired together? Am surprised both the wires are red..,Y,"Yes, it's a twined cable. And why does it surprise you that the cable jacket is red? Most other cables you'll find that the cable jacket is entirely black. So long as the clamps are properly colored that's all that matters.",Automotive
open-ended,B00002243Z,"Jan 29, 2014",1390982400.0,How many amps can this handle?,,Per Coleman Cable specifications 4 gauge 20 foot long cables current rating is 300 amps.,Automotive
yes/no,B00002243Z,"Jan 26, 2014",1390723200.0,Can I use this cables to boost a school bus ?,N,I would think so. I bought them to charge a pull behind dump trailer when the battery would not work. The cables just do reach from the battery on my 350 truck to the back of my truck where the battery is on the trailer. These are the only cables I found that were long enough without going to the super expensive ones.,Automotive
yes/no,B00002N57X,"Apr 29, 2014",1398754800.0,"can this be a replacement for AQ41682059, is themostate avail",Y,It replace these models but you have to use the adapters that come with it. AO416B2059 AO510B2389 FO510B2497 Good luck.,Automotive
open-ended,B00002N57X,"Jun 13, 2014",1402642800.0,"It does not state what RPM this motor is, does anyone know?",,1100 R 1100 1100 RPM Dan CSH,Automotive
open-ended,B00002N57X,"Jul 22, 2013",1374476400.0,Is this motor a lomanco F0510B2944 with a 5 year warranty?cWhat is manufacture date? I do not want the old model f0510b2497,,"I have no idea on that one! You will have to contact the seller directly. I know how to do the work (which isn't that hard)and it fits nicely. Beyond that, I'm afraid you'll have to contact the guy that has them. No doubt, the part number is on the box, as well as on the motor.",Automotive
open-ended,B00002N57X,"Jun 4, 2013",1370329200.0,What is the motor diameter and shaft diameter and lenght? Thanks!,,"This has been a little time since I installed the motor, but I will offer this: the shaft is 1/2"" in diameter, and is about 3"" long. There's a flat on the shaft full length, for the set screw on the fan blades to clamp on. The motor housing is around 5"" in diameter. This motor seems to fit pretty much all of the power roof vents...however, you might have to take the mounting bolts out and install them from the opposite direction for some installations. This is a super easy conversion. I would suggest applying a light coat of grease to the shaft before assembly, to preclude rust from forming, so the job will be easier next time! Lastly, this motor CAN be replaced from indoors, if attic access is practical; however it requires a bit of patience to get everything in place around the four motor mounting brackets. Nice if you have a high and sharply pitched roof!",Automotive
yes/no,B00002N57X,"Oct 4, 2014",1412406000.0,Is this motor 120v,?,"It runs on standard US household current, 110V.",Automotive
yes/no,B00002N57X,"Sep 4, 2014",1409814000.0,will this replace fan model f0510B2944?,?,"I just copied this information from the Lamanco site www.lamanco Are replacement parts available for power vents? Replacement parts for Lomanco power vents, Model 2000, 2000TH, or 1800 can be found in our online store. The most recent motor model number is F0510B2944. This motor replaces several older models (A0416B2059, A0510B2389, F0510B2497). We also have distributors who may stock the motor locally. Please contact customer service to see if the motor is available locally (800-643-5596). Help Topics: Specific Product / 1800 ADD-A-VENT, Specific Product / 2000 Power Vent, Product Support / Powered Vents Hope this helps",Automotive
open-ended,B00002N57X,"Jul 6, 2014",1404630000.0,what is the difference between F0510B2944 and F0512B2506?,,Sorry I have no idea; just tried to research for the best replacement this one it worked for me.,Automotive
open-ended,B00002N57X,"Jul 4, 2014",1404457200.0,what is the number is it F0512B2506? says CertainTeed 3.5Amps P/N 35199,,"I can't be sure. this motor covers a wide variety of applications, differing mainly by whose name is on the original vent kit. I have used this same motor to replace a variety of roof vent motors over the years, and they always fit. as long as the fan blade hub is bored for a 1/2"" diameter shaft, and the outer diameter of the motor is the same, it will fit. the shaft is plenty long enough to allow placing the fan blades in the right position, and the mounting adapters supplied may or may not be needed. The only real change you may need to make is the bolts holding the motor together and serving as mounting bolts may have to be removed, and inserted form the opposite end of the motor...this is easily done, and it depends on how the motor needs to be mounted. It is pretty straight forward to replace the motor, but being in the attic, it is a predictably hot, miserable job! Be sure to turn off the power before starting this job!",Automotive
yes/no,B00002N57X,"Jun 1, 2014",1401606000.0,Will this motor replace Broan motor # 99000237,?,Not sure of model number was used to replace attic fan motor works great. Hope that helps,Automotive
open-ended,B00002N57X,"May 18, 2014",1400396400.0,"How is this motor different than the one Amazon sells that is called ""Lomanco Power Vent Attic Fan Motor 1/10hp 1100 RPM 115 Volts # F0510B2497 ?",,I don't know? I bought the one I have because of the representation that it was a heavy duty model. We have brutal summers here and the attic temp's get well above 100 degrees F. so I got something that was represented as being just a bit stronger. The motor has been working without fail since purchased.,Automotive
open-ended,B00004TFT1,"Jul 22, 2014",1406012400.0,"we bought a barbie jeep at a yard sale. It is a barbie crusin jeep 12v. I found the # for the charger 008010930, but don't know what battery to buy.",,I am not positive but sounds like 12V means you should purchase this 12V battery.,Automotive
open-ended,B00004TFT1,"Sep 13, 2013",1379055600.0,how long to charge,,"Adena, It takes a good twelve to sixteen hours to charge; however, once it is fully charged, your son or daughter has plenty of battery time to wear themselves out before the battery needs recharging for another round of fun and laughter.",Automotive
yes/no,B00004TFT1,"Aug 5, 2013",1375686000.0,How many years did your original battery last from date of purchase? We are about to replace ours &amp; have had it for almost 2yrs.,Y,"Our original battery lasted 2 1/2 years. It still holds a charge for about 30 minutes, but the new one can go all day. Wish we would have done it a little sooner, I'd highly recommend replacing yours now, our son is so happy to ride for long periods again.",Automotive
open-ended,B00004TFT1,"Jun 11, 2014",1402470000.0,"I see the dimensions listed state 6x6x5. Can anyone specify height, width, and length? I'm wondering if it's 5"" tall, wide, or long.",,"6"" tall, 6"" wide, 5"" deep. I ordered one of these when the original 12-volt battery that came with my kids power wheels jeep finally gave out (didn't charge it for a few months). Works great and is identical to the battery that comes with the power wheels. It will not fit into the battery space in the cars that take 6-volt batteries, nor is the plug receptacle compatible with the 6-volt chargers.",Automotive
open-ended,B00004TFT1,"Apr 1, 2011",1301641200.0,why so many failures of this Power Wheels battery? why all these failures of replacement batteries?,,"Pop the top off the old grey battery and remove the plug, then do a search on e-bay for RBC6 and look for the 2 pack batteries. You should get 2 12ah batteries for around $30. then place an inline 30A fuse on the positive wire and use spade connectors to hook to the battery. The stock Fisher Price battery is a 9ah, so the 12ah will last 33% longer and be much cheaper. The FP battery is a sealed lead acid (SLA) battery just like the ones you get on ebay. Do not put a lawn tractor battery in unless you want to risk your kids safety. Go to www.modifiedpowerwheels.com for more tips.",Automotive
open-ended,B00004TFT1,"Sep 26, 2013",1380178800.0,What model number is this battery?,,model 00801-0638 12v,Automotive
yes/no,B00004TFT1,"Apr 4, 2015",1428130800.0,"We stored the garage-sale PW car in the basement, and the battery in the garage. I charged it once in the winter. Is the battery shot now?",Y,Maybe not. We left our battery uncharged all winter long for two winters and it was fine the next spring when we plugged it back into the car. We just recently bought a new battery because the old battery that originally came with the car finally died.,Automotive
open-ended,B00004TFT1,4 days ago,,I would like to know if this is fully compatible with battery model 00801-1460 ?,,The Grey Power Wheels 12 volt battery is compatible with the 00801-1460 number you provided.,Automotive
yes/no,B00004TFT1,12 days ago,,"Will this work for a Kawasaki Brute Force model R8126 TRU ATV? Manual only specifies 12v lead acid, but no part # or precise specs. Thx!",N,The battery hook up does not match up,Automotive
open-ended,B00004TFT1,18 days ago,,i am looking for just a charger for a power wheel the battery says 12v 00801-0638 do you sell just chargers,,"the charger you need is fisher-price, it wll charge 12v gray,6v red, and 6v blue batteries. can be purchased @ amazon or even walmart. amazon will have a better price.",Automotive
yes/no,B00004WLK5,"Jun 24, 2014",1403593200.0,Is this toggle switch UL listed?,Y,"Yes, UL Listed for ratings:20 Amp /125 Volt AC and 10 Amp /277 Volt AC",Automotive
yes/no,B00004WLK5,"Dec 13, 2014",1418457600.0,Will this work on my truck 12 vdc system,Y,yes it will,Automotive
open-ended,B00004WLK5,"Sep 26, 2014",1411714800.0,can this be used as a light switch and also how bid is the screw on part,,"I don't know what kind of light you have in mind, but the typical household light switch for lighting circuits is rated at equal, if not less amps, usually 15-20 amps. Unless you are using it for some higher output lamp, it should work fine. Remember, watts divided by volts equals amps. For instance, if you are operating a 75 watt bulb under a 120 volt circuit, you would determine the amps as 75/120 = .625 amps. If you are operating more than one bulb, be sure to add up all of the bulb wattages before you do the math. This switch is rated at 20 amps, so don't go over the rated amperage. The screw portion of the switch is right at 7/16 in. Be careful and good luck.",Automotive
yes/no,B00004WLK5,"Nov 21, 2013",1385020800.0,will it handle 48v d.c.?,?,"Its more the amps that would be the concern. It says it handles 20amps @ 120vac, so I would think as along as you stay under the 20amps you should be alright.",Automotive
yes/no,B00004WLK5,"Jun 1, 2014",1401606000.0,Is there an alternative from gardner bender for 220VAC ?,?,I have no idea. But the one to ask is Gardner bender.,Automotive
open-ended,B00004WLKD,"Mar 31, 2014",1396249200.0,"Can you tell me the switches actual dimensions? I doubt that it is as big as stated in ""product dimensions"" or is it really almost 5 inches tall?",,"Base: 5/8"" x 1"" x 1/2"" tall. Shaft ~ 1/2"" diameter x 1 1/16"" h. Wire leads are ~ 6"". Cumulative height is 1 5/8""",Automotive
open-ended,B00004WLKD,"Jun 9, 2014",1402297200.0,what is the diameter of the threaded section? It has to fit into a hole of my panel.,,"Hello, The threaded section is about 1/2"" in diameter and about 1 1/16"" tall.",Automotive
open-ended,B00004WLKD,"May 11, 2014",1399791600.0,"So I push this once, and it's on, then I push it again and it's off?",,That's correct....,Automotive
yes/no,B00004WLKD,"Jul 31, 2013",1375254000.0,Can it be used under 220V for a 20W lamp?,?,Sorry No idea,Automotive
open-ended,B00004WLKD,"Apr 14, 2014",1397458800.0,"Will this work for 12V, 20A? Will this in automotive applications?",,Sure. Its just a switch with heavy enough gauge wire to serve that application.,Automotive
open-ended,B00004WLKA,"Sep 13, 2013",1379055600.0,how do I wire this switch for on and off,,"Like the previous person said these have two on positions. If you are looking at the back of this, the left and right don't have any contact. The center is the common. I'll give you an example with a speaker. Say you wanted to wire two speakers so you can chose which one you used. You would divide the connectors so one side is positive and one is negative (right and left side and it doesn't matter which is which). The two center (common) would have the positive and negative connected from the receiver. Now from there you would wire positive and negative on the top for one speaker and the same for the other speaker on the bottom. So now the signal is coming from the receiver and by flipping the switch you are connecting the common signal to either speaker. By flipping the switch to the middle neither speaker would be receiving a signal.",Automotive
open-ended,B00004WLKA,"Dec 30, 2013",1388390400.0,What are the actual product dimensions?,,"1 3/8"" long, 3/4"" wide, 1"" deep(behind mounting surface), 1"" height from mounting surface to top of bat handle",Automotive
yes/no,B00004WLKA,"Jun 1, 2014",1401606000.0,"Can it work with 220 VAC , even on a lower current ?",?,"from the manufacturer's web listing DPDT Toggle Switch GSW-16 GB Switches are leading the industry in quality, durability. This switch features screw terminals and ON-OFF-ON circuitry. This switch fits standard 1/2 in. mounting holes and is perfect for industrial equipment or emergency lighting. Toggle switch, bat handle ON-OFF-ON DPST circuitry 20 Amp @125 Volt AC, 10 Amp 250 Volt AC 4 Screw terminals 1 1/2 HP 125-250 Volt AC PS, any switch I've ever used would work at a lower voltage.",Automotive
yes/no,B00004WLKA,"May 6, 2014",1399359600.0,Can this switch be left in the center off position? I want to use it for a forward/reverse motor. The switch I have now has a unstable center off position.,?,This switch is very stable in the center position. Great switch. Heavy duty.,Automotive
yes/no,B00004WLKA,24 days ago,,can this be used as a 2-speed windshield wiper switch for a 1967 VW beetle?,?,I dont really know.I can tell you that in one position the switch connects the two top terminals to the 2 middle terminals In the other position it connects the bottom 2 terminals to the 2 middle terminals,Automotive
yes/no,B00004WLKA,"Aug 4, 2014",1407135600.0,Does this switch have to be held in the on position in either direction?,N,No,Automotive
yes/no,B00004WLKA,"May 29, 2014",1401346800.0,Does this switch auto return to the off position? What do I look for in a switch to find this info it seems impossible by looking at one online,N,"No, this switch does not automatically return to the off position. It has 3 distinct positions. On-Off-On. You must physically move it to each position. Try searching for a ""momentary"" switch.",Automotive
yes/no,B00004WLKA,"Apr 30, 2014",1398841200.0,"I want a small switch that would control a 12v 12a DC power supply by cutting the 120v ac, would this work?",Y,"Yes, that switch would work fine, assuming you have wire properly. It's actually a little overkill. An SPST switch would work and be less confusing to wire properly.",Automotive
open-ended,B00004WLKA,"Apr 21, 2014",1398063600.0,"Is this switch break-before-make, make-before-break, or unrated?",,As I remember it is double pole double throw....,Automotive
open-ended,B00004WLKA,"Dec 3, 2013",1386057600.0,"Can I use this switch on my atv for front lights and a spot light? (separate ""on"" switches to save the battery) and how do I hook it up!??",,"Only if you want the spot light or the front light on at different times, not both at the same time. Hook power to center screws, spot light on top or bottom & front light to other screws. I use my switch to change the source of power for my construction trailer lights from the truck to a battery pack.",Automotive
open-ended,B00005AXI6,"Jun 2, 2014",1401692400.0,What is the minimun distance from the wall that it can it be set at? I park my truck with the bumper as close to the wall as possible,,"According to the instructions, the front bumper should be 0.5 to 16ft from the Sensor unit. Front wheels 12 -18 inches from the sensor. Hope this helps you. This is the second unit I have had, since 1909. It is great for my car. Myron Whisler",Automotive
open-ended,B00005AXI6,"Oct 14, 2014",1413270000.0,I had read in the company specifications that the battery life was about one year. The reviews from many users complain of the short battery life.,,I have always gotten a year and more.,Automotive
open-ended,B00005AXI6,"Mar 8, 2014",1394265600.0,I replaced batteries then hit the button to reset. It still flashes red! What can I do?,,Never had that problem with my park zone. Never had any problem with it at all. Maybe a battery is in backward.,Automotive
open-ended,B00005AXI6,"Aug 21, 2013",1377068400.0,"With fresh batteries installed, why does it only calibrate from red to yellow(not green) and just continue to flash on yellow?",,"Im on my second one,the first one worked like a charm,the second one not so well. Try taking the batteries back out,unhook both ends of cord,reinstall batteries then reconnect the cord and try to calibrate,if it does the same thing leave it and pull car out,wait to see if it stops flashing. If it does,then pull car in and see if it works properly. Mine acted weird then all of a sudden it started to work properly after a few days and has worked correctly ever since...hope this helps",Automotive
open-ended,B00005AXI6,"May 5, 2014",1399273200.0,how does it work and how is it mounted ?,,"I hate to leave negative feedback but will answer your question. I have had NO LUCK with mine. I called twice to check what I wasn't doing correctly to set it up. Did everything they told me and they were nice about it. Other men have tried to get it to work properly but failed also. Really wanted it to work. Should have returned but kept hoping by some chance it would work, rather stupid of me. So, maybe I just got a bad one. Happens sometimes. So sorry.",Automotive
yes/no,B00005AXI6,"Jan 2, 2015",1420185600.0,I want to pull my car exactly 35 inches from the front wall. Can I set this unit to indicate when I am 35 inches from the wall?,Y,"Yes, pull your car into the garage at 35"" from where the unit is set on the wall, then set the unit at that point. It helps to have another person help set the unit as you drive into the garage to the marked 35"".",Automotive
open-ended,B00005AXI6,"Nov 22, 2014",1416643200.0,It is water resistant?,,No,Automotive
yes/no,B00005AXI6,"Dec 20, 2013",1387526400.0,dedvice flashes continously on red. Does nothing else.,?,Power went out. Reset it.,Automotive
yes/no,B00005AXI6,"Feb 10, 2014",1392019200.0,can it be plugged in??,?,"There are two different Park Zone models. One that is battery only (battery life is good) that can't be plugged in. There is a different model that has a power cord and runs of AC. If you want to plug it in, you have to buy the model that runs of AC power.",Automotive
open-ended,B00005AXI6,"Mar 5, 2014",1394006400.0,how do i reset after changing batteries on park zone parking device,,"Put your device back on the wall. Park your car in the normal position in the garage. Push the button on top of the unit and it will cycle through red, yellow and green and it is reset automatically.",Automotive
open-ended,B000066OC8,16 days ago,,Does it have enough juice in it to power a heating blanket for the night or a few hours?,,All I can tell you is that mine never worked. I didn't know until it was too late to get my money back,Automotive
yes/no,B000066OC8,"Jul 5, 2014",1404543600.0,will the technical specs be included with this item?,Y,"Yes Lois, there is a very easy to read page size instruction sheet that came with mine. It had the specs on it and probably could find it on the internet somewhere. I keep mine with the charger, folded up.",Automotive
open-ended,B000066OC8,"Dec 1, 2013",1385884800.0,My question is NOT about jump starting but if this device has enough power to backup entire car when battery is replaced with new one.,,I think you need a battery in there to complete the circuit anyway.,Automotive
yes/no,B000066OC8,"Dec 1, 2013",1385884800.0,I have Camry Hybrid. 12V battery is only for backup power. Will this device backup for about 15 minutes required to swap out factory battery for new?,?,"I hate to say that this item pretty much served as a paper weight. On the several occasions that my battery died, the Wegan EA2045 didn't help to jump start my 2010 Acura at all. It turns out that the battery was completely dead and my car would start only after a ""traditional"" jump start. It did charge my cell phone while I waited for someone who was able to help with a jump start :) If you do choose to purchase it and you're not satisfied, you'll find it very difficult to return as it's considered hazardous material as I found out. Amazon and the manufacturer however were awesome and refunded the full amount. Good luck!",Automotive
yes/no,B000066OC8,"Jul 19, 2014",1405753200.0,"If you have a drained out car battery, can you plug the Jumpstarter into the DC plug in the car, then plug the AC charger for the Jumpstarter into a 1",?,They don't make that point clear in their advertisement which is why I bought it. The paper work included with the charger states that is does NOT work on a drained or dead battery. Save your money and get AAA instead. They are always able to start the car for you when your battery is dead!,Automotive
open-ended,B000066OC8,"Jan 9, 2014",1389254400.0,whats the best battery jumper?,,Schumacher XP400 400 Peak Amp Instant Portable Power Source,Automotive
yes/no,B00006HNTD,"Jan 22, 2014",1390377600.0,Will this run CFL lighting?,?,It has ran fluorescent tube lighting in my shop without issue. I do not have any cfl's to test. I run mostly LED lighting and it runs that without issue. The people at Tripp Lite are very helpful and normally respond to questions quickly. I highly recommend them.,Automotive
yes/no,B00006HNTD,"Feb 19, 2014",1392796800.0,Does anyone have trouble with buzzing in stereo\television equipment?,?,"Hello, I purchaced to replace a cheape one that I had. Yes, It makes alot of noise, and bleeds over to FM radio's plugged in to it. I do not think it is a true full sine wave, I think it is a modified, wish is why it does that. Other than that, it works great. i lvoe it a great deal. Bob....",Automotive
yes/no,B00006HNTD,"Oct 8, 2014",1412751600.0,Does this unit run off and charge a 24V DC battery pack. The tile states 24V but the specifications list 12V.,Y,"Hi; Since this a brand new unit directly from manufacture, here is the link from the tripp Lite website with all details and spec for that inverter: http://www.tripplite.com/inverter-charger-750w-automatic-transfer-switching-2-outlets~APS750/ Any other questions, let me know I have 4-5 unit of that inverter Thanks",Automotive
yes/no,B00006HNTD,"Jul 21, 2014",1405926000.0,is this 24v,Y,"Yes, I bought this after a cheaper one failed. This one runs a well pump, ac outlets ...ect. its been running well, but its a little loud..",Automotive
open-ended,B00006HNTD,"Nov 2, 2013",1383375600.0,I am off grid live secluded area need tu run my 13 feet refrigerator actualy having strating problems with modified wave inverter can this run 24 hour,,no . i would go with a trace . may be you should change it over to gas . and i have see a conversion to dc units out their . i got a gas frig . as so what it use 200 gal a year . alot cheaper than all those panels etc .,Automotive
